{
  "$schema": "https://json-schema.org/draft/2020-12/schema",
  "$id": "https://openvie.local/contracts/document-ingestion/v1/request.schema.json",
  "title": "Document ingest requested v1",
  "type": "object",
  "additionalProperties": false,
  "required": [
    "schema_version", "event_id", "job_id", "tenant_id", "knowledge_base_id",
    "document_id", "uploader_id", "storage_key", "file_name", "content_type",
    "file_size_bytes", "occurred_at"
  ],
  "properties": {
    "schema_version": {"const": "1.0"},
    "event_id": {"type": "string", "format": "uuid"},
    "job_id": {"type": "string", "format": "uuid"},
    "tenant_id": {"type": "string", "format": "uuid"},
    "knowledge_base_id": {"type": "string", "format": "uuid"},
    "document_id": {"type": "string", "format": "uuid"},
    "uploader_id": {"type": "string", "format": "uuid"},
    "storage_key": {"type": "string", "minLength": 1},
    "file_name": {"type": "string", "minLength": 1},
    "content_type": {"type": "string", "minLength": 1},
    "file_size_bytes": {"type": "integer", "minimum": 0},
    "occurred_at": {"type": "string", "format": "date-time"}
  }
}
