{
  "schema_version": "1.0",
  "event_id": "11111111-1111-4111-8111-111111111111",
  "job_id": "22222222-2222-4222-8222-222222222222",
  "tenant_id": "33333333-3333-4333-8333-333333333333",
  "knowledge_base_id": "44444444-4444-4444-8444-444444444444",
  "document_id": "55555555-5555-4555-8555-555555555555",
  "uploader_id": "66666666-6666-4666-8666-666666666666",
  "storage_key": "tenants/333/kb/444/documents/555/manual.pdf",
  "file_name": "manual.pdf",
  "content_type": "application/pdf",
  "file_size_bytes": 1024,
  "occurred_at": "2026-07-22T00:00:00Z"
}
